order,note_id,status,text,tokens,new_tokens
1,1777322825629,KEEP,¿Qué quieres ahora mismo?,ahora | mismo | querer | qué,ahora | mismo | querer | qué
2,1777322849008,KEEP,¿De dónde vienes ahora?,ahora | de | dónde | vién,de | dónde | vién
3,1777322871442,KEEP,No vienes hoy a la reunión,a | el | hoy | no | reunión | venir,a | el | hoy | no | reunión | venir
4,1777322914830,KEEP,¿A qué hora llegas mañana?,a | hora | llegar | mañana | qué,hora | llegar | mañana
5,1777322934347,KEEP,La puerta no está cerrada todavía,cerrado | el | estar | no | puerta | todavía,cerrado | estar | puerta | todavía
6,1777322943038,KEEP,El tren sale siempre temprano,el | salir | siempre | temprano | tren,salir | siempre | temprano | tren
7,1777322964058,KEEP,Es verdad que no vienes hoy?,hoy | no | que | ser | venir | verdad,que | ser | verdad
8,1777322977165,KEEP,Y nunca dijiste nada ayer,ayer | dijistir | nada | nunca | y,ayer | dijistir | nada | nunca | y
9,1777323013562,KEEP,En verano siempre viajas más,en | más | siempre | verano | viajar,en | más | verano | viajar
10,1777323021490,KEEP,Lo sabes pero no lo dices,decir | no | pero | saber | él,decir | pero | saber | él
11,1777323065159,KEEP,¿Por qué no lo hiciste por mí?,hacer | no | por | qué | yo | él,hacer | por | yo
12,1777323072081,KEEP,¿Qué no entiendes todavía?,entender | no | qué | todavía,entender
13,1777323124159,KEEP,Una vez no llegaste a tiempo,a | llegar | no | tiempo | uno | vez,tiempo | uno | vez
14,1777323131907,KEEP,Te dije que no vinieras hoy,decir | hoy | no | que | tú | vinierar,tú | vinierar
15,1777323147771,KEEP,Los libros nunca están aquí,aquí | el | estar | libro | nunca,aquí | libro
16,1777323155190,KEEP,Se levanta temprano cada día,cada | día | levantar | temprano | él,cada | día | levantar
17,1777323228278,KEEP,Con amigos nunca estás solo,amigo | con | estar | nunca | solo,amigo | con | solo
18,1777323245078,KEEP,Para mañana no está listo todavía,estar | listo | mañana | no | para | todavía,listo | para
19,1777323259590,KEEP,Mi teléfono nunca suena hoy,hoy | mi | nunca | sonar | teléfono,mi | sonar | teléfono
20,1777323290120,KEEP,¿Está listo el informe ahora?,ahora | el | estar | informe | listo,informe
21,1777323312646,KEEP,Sí vienes mañana a clase,a | clase | mañana | sí | venir,clase | sí
22,1777323329115,KEEP,¿Estás bien hoy o no?,bien | estar | hoy | no | o,bien | o
23,1777323343379,KEEP,Pero no vienes nunca temprano,no | nunca | pero | temprano | vienar,vienar
24,1777323372807,KEEP,Eso no lo entiendes todavía,entender | ese | no | todavía | él,ese
25,1777323405957,KEEP,Las llaves nunca están aquí,aquí | el | estar | llave | nunca,llave
26,1777323414463,KEEP,Sí vienes mañana sin excusas,excusa | mañana | sin | sí | venir,excusa | sin
27,1777323512867,KEEP,Su coche nunca está limpio hoy,coche | estar | hoy | limpio | nunca | su,coche | limpio | su
28,1777323580846,KEEP,Tu no vienes aquí ahora,ahora | aquí | no | tu | vienar,tu
29,1777323588170,KEEP,Aquí no hay nada hoy,aquí | haber | hoy | nada | no,haber
30,1777323608029,KEEP,Del trabajo ya no hablas,del | hab él | no | trabajo | ya,del | hab él | trabajo | ya
31,1777323616547,KEEP,Al llegar nunca dices nada,al | diz | llegar | nada | nunca,al | diz
32,1777323622346,KEEP,"Como no vienes, espero aquí",aquí | como | esperar | no | vienar,como | esperar
33,1777323644639,KEEP,Esto no lo entiendes bien,bien | entiend | este | no | él,entiend | este
34,1777323654004,KEEP,Ya no vienes como antes,antes | como | no | vienar | ya,antes
35,1777323664929,KEEP,Todo está listo ahora mismo,ahora | estar | listo | mismo | todo,todo
36,1777323675133,KEEP,Esta vez no fallas nunca,este | fallar | no | nunca | vez,fallar
37,1777323701986,KEEP,Vamos ahora sin esperar más,ahora | esperar | ir | más | sin,ir
38,1777323711609,KEEP,Muy bien no lo haces hoy,bien | hacer | hoy | mucho | no | él,mucho
39,1777323723545,KEEP,Hay algo que no entiendes,algo | entiend | haber | no | que,algo
40,1777323730244,KEEP,Ahora no puedes salir,ahora | no | poder | salir,poder
41,1777323738447,KEEP,Algo no funciona aquí,algo | aquí | funcionar | no,funcionar
42,1777323746540,KEEP,Estoy aquí pero no hablo,aquí | estar | hablar | no | pero,hablar
43,1777323752147,KEEP,Tengo algo que decir ahora,ahora | algo | decir | que | tener,tener
44,1777323760665,KEEP,Nos ves pero no hablas,hab él | no | pero | ver | yo,ver
45,1777323875850,KEEP,Nada ocurre aquí ahora,ahora | aquí | nada | ocurrir,ocurrir
46,1777323883506,KEEP,"Cuando vienes, ya me voy",cuando | ir | venir | ya | yo,cuando
47,1777323891015,KEEP,Ha terminado el trabajo hoy,el | haber | hoy | terminar | trabajo,terminar
48,1777323923334,KEEP,Este problema no es fácil,este | fácil | no | problema | ser,fácil | problema
49,1777323977219,KEEP,Así no vienes nunca temprano,así | no | nunca | temprano | vienar,así
50,1777324006330,KEEP,Puedo venir ahora si quieres,ahora | poder | querer | si | venir,si
51,1777363608628,KEEP,¿Puedo abrir la ventana ahora?,abrir | ahora | el | poder | ventana,abrir | ventana
52,1777363622980,KEEP,¿Cómo resolviste ese problema ayer?,ayer | cómo | ese | problema | resolvistar,cómo | resolvistar
53,1777363630185,KEEP,Quiero aprender español este año,aprender | año | español | este | querer,aprender | año | español
54,1777363636441,KEEP,Sólo necesito cinco minutos más,minuto | más | necesitar | sólo,minuto | necesitar | sólo
55,1777363646753,KEEP,Soy responsable de este proyecto,de | este | proyecto | responsable | ser,proyecto | responsable
56,1777363671930,KEEP,Gracias por ayudarme con eso,ayudar yo | con | ese | gracias | por,ayudar yo | gracias
57,1777363680000,KEEP,¿Prefieres café o té caliente?,café | caliente | o | prefieres | té,café | caliente | prefieres | té
58,1777363692878,KEEP,Este resultado no es bueno,bueno | este | no | resultado | ser,bueno | resultado
59,1777363704193,KEEP,Fue una decisión muy difícil ayer,ayer | decisión | difícil | mucho | ser | uno,decisión | difícil
60,1777363743838,KEEP,Ser honesto siempre vale la pena,el | honesto | pena | ser | siempre | valer,honesto | pena | valer
61,1777363756575,KEEP,Voy a hacer ejercicio mañana temprano,a | ejercicio | hacer | ir | mañana | temprano,ejercicio
62,1777363812878,KEEP,Son mis compañeros desde la universidad,compañero | desde | el | mi | ser | universidad,compañero | desde | universidad
63,1777363818362,KEEP,No todos entienden esta explicación,entender | este | explicación | no | todo,explicación
64,1777363827351,KEEP,Antes todo era más sencillo aquí,antes | aquí | más | sencillo | ser | todo,sencillo
65,1777363835492,KEEP,¿Eres tú la persona responsable?,el | persona | responsable | ser | tú,persona
66,1777363854160,KEEP,Es la primera vez que vengo,el | primero | que | ser | venir | vez,primero
67,1777363930303,KEEP,Creo que ya no funciona bien,bien | creer | funcionar | no | que | ya,creer
68,1777363945506,KEEP,Ella todavía trabaja en ese proyecto,en | ese | proyecto | todavía | trabajar | él,trabajar
69,1777363952250,KEEP,He visto esa película muchas veces,ese | haber | mucho | película | ver | vez,película
70,1777363959594,KEEP,No quiero comprar ese producto,comprar | ese | no | producto | querer,comprar | producto
71,1777363983496,KEEP,Voy a llamarte después de cenar,a | cenar | de | después | ir | llamarte,cenar | después | llamarte
72,1777363991043,KEEP,Puede que lleguemos tarde mañana,llegu | mañana | poder | que | tarde,llegu | tarde
73,1777364002157,KEEP,¿Sabes dónde dejé mis llaves?,dejar | dónde | llave | mi | sabes,dejar | sabes
74,1777364020875,KEEP,"Hola, ¿ya terminaste el informe?",el | hola | informe | terminastar | ya,hola | terminastar
75,1777364026545,KEEP,Sus ideas no coinciden con las mías,coincidir | con | el | idea | mía | no | su,coincidir | idea | mía
76,1777364031834,KEEP,No salí porque estaba muy cansado,cansado | estar | mucho | no | porque | salí,cansado | porque | salí
77,1777364038566,KEEP,Dios sabe lo que pasará mañana,dios | mañana | pasar | que | saber | él,dios | pasar
78,1777364043949,KEEP,¿Quién te contó esa historia ayer?,ayer | contar | ese | historia | quién | tú,contar | historia | quién
79,1777364050199,KEEP,Nunca he probado ese tipo de comida,comida | de | ese | haber | nunca | probar | tipo,comida | probar | tipo
80,1777364072847,KEEP,¿Dónde vas a pasar las vacaciones?,a | dónde | el | ir | pasar | vacación,vacación
81,1777364103070,KEEP,¿Quieres venir conmigo esta noche?,conmigo | este | noche | querer | venir,conmigo | noche
82,1777364115314,KEEP,Mi casa queda cerca del trabajo,casa | cerca | del | mi | quedar | trabajo,casa | cerca | quedar
83,1777364128973,KEEP,"Hazme un favor, cierra la puerta",cerrar | el | favor | hazme | puerta | uno,cerrar | favor | hazme
84,1777364135710,KEEP,Esa decisión no tiene sentido ahora,ahora | decisión | ese | no | sentido | tener,sentido
85,1777364144361,KEEP,Compré dos entradas para el concierto,comprar | concierto | el | entrada | para,concierto | entrada
86,1777364149996,KEEP,No es tan complicado como parece,como | complicado | no | parecer | ser | tanto,complicado | parecer | tanto
87,1777364156104,KEEP,"Señor, su mesa está lista ya",estar | listo | mesa | señor | su | ya,mesa | señor
88,1777364173192,KEEP,¿Dices la verdad o estás bromeando?,bromear | decir | el | estar | o | verdad,bromear
89,1777364179989,KEEP,Estaba pensando en cambiar de trabajo,cambiar | de | en | estar | pensar | trabajo,cambiar | pensar
90,1777364219009,KEEP,Hoy me siento mucho mejor que ayer,ayer | hoy | mejor | mucho | que | sentir | yo,mejor | sentir
91,1777364226288,KEEP,Mis amigos están en la oficina ahora,ahora | amigo | el | en | estar | mi | oficina,oficina
92,1777364231426,KEEP,El tren va directo al centro,al | centro | directo | el | ir | tren,centro | directo
93,1777364238877,KEEP,Ese hombre nunca dice la verdad,decir | el | ese | hombre | nunca | verdad,hombre
94,1777364245761,KEEP,¿Usted necesita ayuda con eso?,ayuda | con | ese | necesitar | usted,ayuda | usted
95,1777364256650,KEEP,No tengo mucho interés en eso,en | ese | interés | mucho | no | tener,interés
96,1777364265168,KEEP,Hace frío por la mañana aquí,aquí | el | frío | hacer | mañana | por,frío
97,1777364274593,KEEP,Entonces hablamos después de la reunión,de | después | el | entonces | hablar | reunión,entonces
98,1777364280237,KEEP,Siento que algo no está bien,algo | bien | estar | no | que | siento,siento
99,1777364285354,KEEP,Tenemos que resolver este problema pronto,este | problema | pronto | que | resolver | tener,pronto | resolver
100,1777364437976,KEEP,¿Puedes explicarme esto con más detalle?,con | detalle | este | explicar yo | más | poder,detalle | explicar yo
