order,note_id,status,front_text,tokens,new_tokens
1062,1774709480028,KEEP,Aku mencoba menangkap bola di udara,aku | bola | di | menangkap | mencoba | udara,bola | menangkap
1063,1774709523800,KEEP,"Awas, ada mobil melaju cepat",ada | awas | cepat | melaju | mobil,awas | melaju
1064,1774709565395,KEEP,Aku akan duduk di bawah pohon rindang itu,akan | aku | bawah | di | duduk | itu | pohon | rindang,rindang
1065,1774709579382,KEEP,Mohon bantu aku membawa tas ini,aku | bantu | ini | membawa | mohon | tas,mohon
1066,1774709624298,KEEP,Aku menaruh buku-bukuku di ransel baru,aku | baru | buku | bukuku | di | menaruh | ransel,bukuku
1067,1774709654752,KEEP,Makan malam tadi malam sangat lezat sekali,lezat | makan | malam | sangat | sekali | tadi,lezat
1068,1774709668762,KEEP,Es krim ini terasa sangat enak,enak | es | ini | krim | sangat | terasa,enak
1069,1774709710008,KEEP,Aku akan membeli makan siang di kantin,akan | aku | di | kantin | makan | membeli | siang,kantin
1070,1774709823754,KEEP,Kami mengunjungi makam kakek kemarin,kakek | kami | kemarin | makam | mengunjungi,kakek | makam
1071,1774709832129,KEEP,Ini pertama kali aku mencoba sushi,aku | ini | kali | mencoba | pertama | sushi,sushi
1072,1774709852314,KEEP,Aku memenangkan perlombaan untuk pertama kali,aku | kali | memenangkan | perlombaan | pertama | untuk,memenangkan | perlombaan
1073,1774709868303,KEEP,Anak-anak sedang berlomba di lapangan sekolah,anak-anak | berlomba | di | lapangan | sedang | sekolah,berlomba | lapangan
1074,1774709874295,KEEP,Dia tiba di tempat kedua dalam lomba,dalam | di | dia | kedua | lomba | tempat | tiba,kedua | lomba
1075,1774709904915,KEEP,Tanaman itu mati karena kekurangan air,air | itu | karena | kekurangan | mati | tanaman,kekurangan
1076,1774710014953,KEEP,Pacarku sedang menungguku di kafe,di | kafe | menungguku | pacarku | sedang,pacarku
1077,1774710038022,KEEP,Aku ingin mengajak pacar jalan sore ini,aku | ingin | ini | jalan | mengajak | pacar | sore,mengajak | pacar
1078,1774710054921,KEEP,Aku mendengar getak kayu saat berjalan malam,aku | berjalan | getak | kayu | malam | mendengar | saat,getak
1079,1774710085142,KEEP,Singa itu sedang berbaring di savana,berbaring | di | itu | savana | sedang | singa,berbaring | savana | singa
1080,1774710111084,KEEP,Aku ingin baring sejenak di sofa,aku | baring | di | ingin | sejenak | sofa,baring | sejenak
1081,1774710123927,KEEP,"Tunggu sebentar, aku butuh jeda jenak",aku | butuh | jeda | jenak | sebentar | tunggu,jenak
1082,1774710135505,KEEP,Kita harus jeda sebentar sebelum melanjutkan,harus | jeda | kita | melanjutkan | sebelum | sebentar,melanjutkan
1083,1774710493203,KEEP,Aku akan simpan surat ini dengan aman,akan | aku | aman | dengan | ini | simpan | surat,surat
1084,1774710513725,KEEP,Anjing itu mengubur tulang di halaman,anjing | di | halaman | itu | mengubur | tulang,mengubur | tulang
1085,1774710531767,KEEP,Jari itu mulai berdarah setelah teriris,berdarah | itu | jari | mulai | setelah | teriris,berdarah | teriris
1086,1774710548402,KEEP,Aku mengiris apel untuk sarapan pagi,aku | apel | mengiris | pagi | sarapan | untuk,mengiris
1087,1774710570523,KEEP,Aku menaruh potongan nanas di pizza,aku | di | menaruh | nanas | pizza | potongan,pizza | potongan
1088,1774710632981,KEEP,Tentara itu sedang berlatih di lapangan,berlatih | di | itu | lapangan | sedang | tentara,tentara
1089,1774710690502,KEEP,"Hati-hati, lantai di sini sangat licin",di | hati-hati | lantai | licin | sangat | sini,hati-hati
1090,1774710704176,KEEP,Tanaman itu tumbuh subur di tanah ini,di | ini | itu | subur | tanah | tanaman | tumbuh,subur
1091,1774710728741,KEEP,Lahan ini sangat subur untuk menanam sayur,ini | lahan | menanam | sangat | sayur | subur | untuk,lahan
1092,1774710747422,KEEP,Aku membeli sayuran segar di pasar pagi,aku | di | membeli | pagi | pasar | sayuran | segar,sayuran
1093,1774710766126,KEEP,Toko itu menjual buah-buahan segar setiap hari,buah-buahan | hari | itu | menjual | segar | setiap | toko,buah-buahan
1094,1774710782878,KEEP,Aku minum air kelapa di pantai,air | aku | di | kelapa | minum | pantai,kelapa
1095,1774710801600,KEEP,Kucing itu mengejar ekor sendiri di ruang tamu,di | ekor | itu | kucing | mengejar | ruang | sendiri | tamu,ekor
1096,1774711656397,KEEP,Aku menyematkan bros di jaket baruku,aku | baruku | bros | di | jaket | menyematkan,bros | jaket | menyematkan
1097,1774711670923,KEEP,Aku akan sematkan label itu di kotak,akan | aku | di | itu | kotak | label | sematkan,label | sematkan
1098,1774711713357,KEEP,Aku mengenakan sabuk baru untuk celana,aku | baru | celana | mengenakan | sabuk | untuk,mengenakan | sabuk
1099,1774711730508,KEEP,Sepatu ini terasa sangat genak di kakiku,di | genak | ini | kakiku | sangat | sepatu | terasa,genak
1100,1774711794849,KEEP,Kura-kura itu berjalan lambat di taman,berjalan | di | itu | kura-kura | lambat | taman,kura-kura | lambat
1101,1774711812351,KEEP,Serigala itu mengaum di tengah hutan malam,di | hutan | itu | malam | mengaum | serigala | tengah,mengaum | serigala | tengah
1102,1774711817334,KEEP,Kura itu berjemur di bawah sinar matahari,bawah | berjemur | di | itu | kura | matahari | sinar,berjemur | kura | sinar
1103,1774712651576,KEEP,Hiu itu berenang dekat permukaan laut,berenang | dekat | hiu | itu | laut | permukaan,hiu | permukaan
1104,1774712676509,KEEP,Kadal itu bersembunyi di balik batu,balik | batu | bersembunyi | di | itu | kadal,bersembunyi | kadal
1105,1774712728209,KEEP,Negara itu terkenal dengan pemandangan indahnya,dengan | indahnya | itu | negara | pemandangan | terkenal,indahnya
1106,1774712772189,KEEP,Jamur itu tumbuh di roti yang basah,basah | di | itu | jamur | roti | tumbuh | yang,jamur
1107,1774712792458,KEEP,Buah itu mulai membusuk karena panas,buah | itu | karena | membusuk | mulai | panas,membusuk
1108,1774712806611,KEEP,Apel itu dibusuk setelah seminggu disimpan,apel | dibusuk | disimpan | itu | seminggu | setelah,dibusuk | seminggu
1109,1774712872941,KEEP,Unta itu berjalan di gurun pasir dengan sabar,berjalan | dengan | di | gurun | itu | pasir | sabar | unta,unta
1110,1774712890278,KEEP,Kami berkemah di gurun selama dua hari,berkemah | di | dua | gurun | hari | kami | selama,berkemah | selama
1111,1774712968313,KEEP,Jendela itu terbuat dari kaca bening,bening | dari | itu | jendela | kaca | terbuat,bening
1112,1774712984747,KEEP,Cincin itu dihiasi dengan berlian kecil,berlian | cincin | dengan | dihiasi | itu | kecil,berlian
1113,1774713003580,KEEP,Astronom mempelajari bintang di galaksi jauh,astronom | bintang | di | galaksi | jauh | mempelajari,astronom
1114,1774713015471,KEEP,Astronot itu bersiap naik ke stasiun luar angkasa,angkasa | astronot | bersiap | itu | ke | luar | naik | stasiun,angkasa | astronot | bersiap
1115,1774713028138,KEEP,Roket itu meluncur tinggi ke angkasa,angkasa | itu | ke | meluncur | roket | tinggi,meluncur | roket
1116,1774713056018,KEEP,Air dari mata air itu mulai muncur pagi ini,air | dari | ini | itu | mata | mulai | muncur | pagi,muncur
1117,1774713100687,KEEP,Aku memakai kacamata saat membaca buku,aku | buku | kacamata | memakai | membaca | saat,kacamata
1118,1774713112296,KEEP,Aku memotong wortel untuk sup malam ini,aku | ini | malam | memotong | sup | untuk | wortel,wortel
1119,1774713123617,KEEP,Aku menambahkan selada ke dalam sandwich,aku | dalam | ke | menambahkan | sandwich | selada,sandwich | selada
1120,1774713196801,KEEP,Aku membuat salad sayuran segar untuk makan siang,aku | makan | membuat | salad | sayuran | segar | siang | untuk,salad
1121,1774713207644,KEEP,Aku suka memasak makanan Italia di rumah,aku | di | italia | makanan | memasak | rumah | suka,italia
1122,1774713222358,KEEP,Aku merasakan sakit di untu gerahamku,aku | di | gerahamku | merasakan | sakit | untu,gerahamku | untu
1123,1774713249381,KEEP,Unta itu minum air dari oase di gurun,air | dari | di | gurun | itu | minum | oase | unta,oase
1124,1774713342992,KEEP,Anjing itu mulai menggigit tulangnya dengan cepat,anjing | cepat | dengan | itu | menggigit | mulai | tulangnya,tulangnya
1125,1774713411367,KEEP,Aku sarap makan kue cokelat itu tadi,aku | cokelat | itu | kue | makan | sarap | tadi,sarap
1126,1774713416733,KEEP,Ratu itu memakai mahkota emasnya di pesta,di | emasnya | itu | mahkota | memakai | pesta | ratu,emasnya | mahkota | ratu
1127,1774713441760,KEEP,Cincin itu terbuat dari emas murni,cincin | dari | emas | itu | murni | terbuat,murni
1128,1774713508705,KEEP,Suara pianonya terdengar murni tanpa gangguan,gangguan | murni | pianonya | suara | tanpa | terdengar,gangguan | pianonya
1129,1774713540190,KEEP,Niatnya murni saat membantu tetangga itu,itu | membantu | murni | niatnya | saat | tetangga,membantu | niatnya
1130,1774713547969,KEEP,Minyak zaitun ini murni dan berkualitas tinggi,berkualitas | dan | ini | minyak | murni | tinggi | zaitun,berkualitas | minyak | zaitun
1131,1774713560406,KEEP,Keju itu memiliki rasa murni dan alami,alami | dan | itu | keju | memiliki | murni | rasa,alami | keju
1132,1774713586059,KEEP,Aku punya niat baik membantu teman itu,aku | baik | itu | membantu | niat | punya | teman,niat
1133,1774713734601,KEEP,Aku memetik zaitun langsung dari pohonnya,aku | dari | langsung | memetik | pohonnya | zaitun,memetik | pohonnya
1134,1774713773336,KEEP,Aku memasak mie instan untuk makan malam,aku | instan | makan | malam | memasak | mie | untuk,instan | mie
1135,1774713796165,KEEP,Kopi instan ini mudah diseduh kapan saja,diseduh | ini | instan | kapan | kopi | mudah | saja,diseduh
1136,1774713811170,KEEP,Aku akan seduh teh hijau sore ini,akan | aku | hijau | ini | seduh | sore | teh,seduh
1137,1774713827296,KEEP,Alpha itu memimpin kelompok hewan di hutan,alpha | di | hewan | hutan | itu | kelompok | memimpin,alpha | kelompok | memimpin
1138,1774713844734,KEEP,Kelompok siswa itu sedang berdiskusi di kelas,berdiskusi | di | itu | kelas | kelompok | sedang | siswa,berdiskusi | siswa
1139,1774713860392,KEEP,Kami mengadakan diskusi tentang proyek baru,baru | diskusi | kami | mengadakan | proyek | tentang,mengadakan
1140,1774713878939,KEEP,Gadak itu terbang di malam hari mencari makanan,di | gadak | hari | itu | makanan | malam | mencari | terbang,gadak
1141,1774713901415,KEEP,Bunga itu berwarna ungu di taman,berwarna | bunga | di | itu | taman | ungu,ungu
1142,1774713926411,KEEP,Langit terlihat abu-abu sebelum hujan turun,abu-abu | hujan | langit | sebelum | terlihat | turun,abu-abu
1143,1774713947371,KEEP,Komodo itu berjalan lambat di pulau sepi,berjalan | di | itu | komodo | lambat | pulau | sepi,sepi
1144,1774714012292,KEEP,Aku merasa kepanasan di bawah matahari siang,aku | bawah | di | kepanasan | matahari | merasa | siang,kepanasan
1145,1774714031484,KEEP,Truk itu mengangkut barang ke pasar pagi ini,barang | ini | itu | ke | mengangkut | pagi | pasar | truk,mengangkut | truk
1146,1774714053774,KEEP,Barang itu akan digangkut ke gudang sore ini,akan | barang | digangkut | gudang | ini | itu | ke | sore,digangkut | gudang
1147,1774714190915,KEEP,Pekerja menata kotak di dalam gudang,dalam | di | gudang | kotak | menata | pekerja,menata
1148,1774714198103,KEEP,Ban mobil itu bocor saat perjalanan jauh,ban | bocor | itu | jauh | mobil | perjalanan | saat,ban
1149,1774714231896,KEEP,Petir menyambar pohon di halaman malam tadi,di | halaman | malam | menyambar | petir | pohon | tadi,menyambar | petir
1150,1774714254116,KEEP,Aku menanak kentang untuk lauk makan malam,aku | kentang | lauk | makan | malam | menanak | untuk,lauk | menanak
1151,1774714270971,KEEP,Ikan goreng itu menjadi lauk favorit keluarga,favorit | goreng | ikan | itu | keluarga | lauk | menjadi,favorit
1152,1774714304025,KEEP,Tempe goreng menjadi lauk sederhana di rumah,di | goreng | lauk | menjadi | rumah | sederhana | tempe,tempe
1153,1774714311209,KEEP,Lauk itu dimasak dengan bumbu khas daerah,bumbu | daerah | dengan | dimasak | itu | khas | lauk,dimasak | khas
1154,1774714319601,KEEP,Kami menyiapkan berbagai lauk untuk pesta keluarga,berbagai | kami | keluarga | lauk | menyiapkan | pesta | untuk,berbagai
1155,1774714331750,KEEP,Ikan asin sering dijadikan lauk di pagi hari,asin | di | dijadikan | hari | ikan | lauk | pagi | sering,dijadikan
1156,1774715451561,KEEP,Presiden akan memberikan pidato di televisi malam ini,akan | di | ini | malam | memberikan | pidato | presiden | televisi,pidato | presiden
1157,1774715464745,KEEP,Dia mempersiapkan pidato untuk acara sekolah besok,acara | besok | dia | mempersiapkan | pidato | sekolah | untuk,mempersiapkan
1158,1774715492135,KEEP,Aku mengikuti instruksi guru dengan teliti,aku | dengan | guru | instruksi | mengikuti | teliti,teliti
1159,1774715497572,KEEP,Aku tidak lagi berbicara dengan mantan pacarku,aku | berbicara | dengan | lagi | mantan | pacarku | tidak,mantan
1160,1774715513986,KEEP,Menhan menghadiri rapat strategi pertahanan nasional,menghadiri | menhan | nasional | pertahanan | rapat | strategi,menghadiri | menhan | nasional | pertahanan | strategi
1161,1774715564779,KEEP,Tentara itu memperkuat pertahanan di perbatasan,di | itu | memperkuat | perbatasan | pertahanan | tentara,memperkuat | perbatasan
1162,1774715628545,KEEP,Dia memperoleh gelar sarjana dari universitas ternama,dari | dia | gelar | memperoleh | sarjana | ternama | universitas,gelar | memperoleh | sarjana | ternama
1163,1774715688323,KEEP,Universitas ini ternama karena kualitas pendidikannya,ini | karena | kualitas | pendidikannya | ternama | universitas,pendidikannya
1164,1774715707708,KEEP,Film itu ternama karena ceritanya yang unik,ceritanya | film | itu | karena | ternama | unik | yang,ceritanya
1165,1774715713649,KEEP,Penulis ternama itu baru meluncurkan buku baru,baru | buku | itu | meluncurkan | penulis | ternama,meluncurkan | penulis
1166,1774715792568,KEEP,Aku ingin memperoleh pengalaman kerja di luar negeri,aku | di | ingin | kerja | luar | memperoleh | negeri | pengalaman,negeri | pengalaman
1167,1774715840620,KEEP,Pemerintah membagikan sembako kepada warga terdampak banjir,banjir | kepada | membagikan | pemerintah | sembako | terdampak | warga,sembako
1168,1774715857500,KEEP,Warga desa itu ramah dan saling menolong,dan | desa | itu | menolong | ramah | saling | warga,menolong | saling
1169,1774715871705,KEEP,Tolong bawakan tas ini ke kamar atas,atas | bawakan | ini | kamar | ke | tas | tolong,bawakan
1170,1774715897798,KEEP,Aku berfoto di Monas saat liburan Jakarta,aku | berfoto | di | jakarta | liburan | monas | saat,berfoto | monas
1171,1774715938946,KEEP,Guru itu memberi ceramah tentang pentingnya disiplin,ceramah | disiplin | guru | itu | memberi | pentingnya | tentang,ceramah | disiplin | pentingnya
1172,1774716047073,KEEP,Lampu itu terbuat dari kristal yang berkilau,berkilau | dari | itu | kristal | lampu | terbuat | yang,berkilau | kristal
1173,1774716097136,KEEP,Cincin itu memancarkan kilau di bawah cahaya,bawah | cahaya | cincin | di | itu | kilau | memancarkan,kilau | memancarkan
1174,1774716225703,KEEP,Buah lemon itu terasa sangat asam di lidah,asam | buah | di | itu | lemon | lidah | sangat | terasa,asam | lemon | lidah
1175,1774716252965,KEEP,Aku menjilat permen itu dengan lidah,aku | dengan | itu | lidah | menjilat | permen,menjilat | permen
1176,1774716279459,KEEP,Dia menahan lidahnya agar tidak berbicara,agar | berbicara | dia | lidahnya | menahan | tidak,lidahnya | menahan
1177,1774716293871,KEEP,Lidah bisa membedakan rasa manis dan pahit,bisa | dan | lidah | manis | membedakan | pahit | rasa,membedakan | pahit
1178,1774716525822,KEEP,Mereka berusaha membedakan fakta dan opini,berusaha | dan | fakta | membedakan | mereka | opini,berusaha | fakta | opini
1179,1774716576861,KEEP,Kesuksesan itu membutuhkan usaha dan kesabaran,dan | itu | kesabaran | kesuksesan | membutuhkan | usaha,kesuksesan | membutuhkan | usaha
1180,1774716605488,KEEP,Dia merayakan kesuksesan proyek besar perusahaan,besar | dia | kesuksesan | merayakan | perusahaan | proyek,merayakan
1181,1774716611736,KEEP,Kesuksesan tidak selalu diukur dari uang semata,dari | diukur | kesuksesan | selalu | semata | tidak | uang,diukur | semata
1182,1774716622361,KEEP,Orang tua bangga atas kesuksesan anaknya,anaknya | atas | bangga | kesuksesan | orang | tua,bangga
1183,1774716638925,KEEP,Kesuksesan akademik membutuhkan disiplin dan fokus,akademik | dan | disiplin | fokus | kesuksesan | membutuhkan,akademik
1184,1774716739193,KEEP,Prestasi akademik siswa itu sangat mengesankan,akademik | itu | mengesankan | prestasi | sangat | siswa,mengesankan | prestasi
1185,1774716743290,KEEP,Kami membahas isu akademik di universitas kemarin,akademik | di | isu | kami | kemarin | membahas | universitas,isu
1186,1774716751727,KEEP,Beasiswa ini diberikan berdasarkan kemampuan akademik,akademik | beasiswa | berdasarkan | diberikan | ini | kemampuan,beasiswa | berdasarkan | diberikan
1187,1774716776800,KEEP,Tim itu unggul dalam pertandingan sepak bola kemarin,bola | dalam | itu | kemarin | pertandingan | sepak | tim | unggul,sepak | unggul
1188,1774716797550,KEEP,Aku ingin menyebut namamu dalam pidato nanti,aku | dalam | ingin | menyebut | namamu | nanti | pidato,menyebut | namamu
1189,1774716829107,KEEP,Dia memenangkan permainan kartu dengan satu as,as | dengan | dia | kartu | memenangkan | permainan | satu,as | kartu
1190,1774716956723,KEEP,Perang itu berlangsung selama bertahun-tahun di negara itu,berlangsung | bertahun-tahun | di | itu | negara | perang | selama,bertahun-tahun | perang
1191,1774716991723,KEEP,Tolong tampilkan data terbaru di layar utama,data | di | layar | tampilkan | terbaru | tolong | utama,tampilkan
1192,1774717008721,KEEP,Polisi menangkap pelaku kejahatan kemarin malam,kejahatan | kemarin | malam | menangkap | pelaku | polisi,kejahatan | pelaku | polisi
1193,1774717023121,KEEP,Tentara menjinakkan bom yang ditemukan di jalan,bom | di | ditemukan | jalan | menjinakkan | tentara | yang,bom | ditemukan | menjinakkan
1194,1774717049022,KEEP,The soldiers defused the bomb found on the street,bomb | defused | found | on | soldiers | street | the,bomb | defused | found | on | soldiers | street | the
1195,1774717074951,KEEP,Pertengkaran itu berujung pada permintaan maaf,berujung | itu | maaf | pada | permintaan | pertengkaran,berujung | permintaan | pertengkaran
1196,1774717135981,KEEP,Kamu harus memegang ujung tali dengan kuat,dengan | harus | kamu | kuat | memegang | tali | ujung,ujung
1197,1774717151906,KEEP,Aku mengelap tangan dengan serbet setelah makan,aku | dengan | makan | mengelap | serbet | setelah | tangan,mengelap | serbet
1198,1774717275733,KEEP,Semen itu dicor ke dalam cetakan bangunan,bangunan | cetakan | dalam | dicor | itu | ke | semen,cetakan | dicor
1199,1774717288557,KEEP,Adonan kue dituangkan ke dalam cetakan kecil,adonan | cetakan | dalam | dituangkan | ke | kecil | kue,adonan | dituangkan
1200,1774717322356,KEEP,Konflik di Yaman telah berlangsung bertahun-tahun,berlangsung | bertahun-tahun | di | konflik | telah | yaman,konflik | yaman
1201,1774798005717,KEEP,Aku belum pernah ke Afganistan,afganistan | aku | belum | ke | pernah,afganistan
1202,1774798029811,KEEP,Apakah kamu akan pergi ke Albania besok?,akan | albania | apakah | besok | kamu | ke | pergi,albania
1203,1774798053670,KEEP,Dia tidak tinggal di Aljazair sekarang,aljazair | di | dia | sekarang | tidak | tinggal,aljazair
1204,1774798074186,KEEP,Kami sedang merencanakan liburan ke Andorra,andorra | kami | ke | liburan | merencanakan | sedang,andorra
1205,1774798088914,KEEP,Apakah mereka sudah tiba di Angola tadi?,angola | apakah | di | mereka | sudah | tadi | tiba,angola
1206,1774798116127,KEEP,Aku akan bekerja di Argentina tahun depan,akan | aku | argentina | bekerja | depan | di | tahun,argentina
1207,1774798134842,KEEP,Kami belum pernah mengunjungi Armenia sebelumnya,armenia | belum | kami | mengunjungi | pernah | sebelumnya,armenia
1208,1774798158060,KEEP,Dia sedang belajar di Australia sekarang,australia | belajar | di | dia | sedang | sekarang,australia
1209,1774798189731,KEEP,Apakah dia tidak akan pindah ke Austria?,akan | apakah | austria | dia | ke | pindah | tidak,austria
1210,1774798375442,KEEP,Aku pernah menghadiri konferensi di Azerbaijan,aku | azerbaijan | di | konferensi | menghadiri | pernah,azerbaijan | konferensi
1211,1774798387482,KEEP,Mereka akan berlibur ke Bahama musim panas ini,akan | bahama | berlibur | ini | ke | mereka | musim | panas,bahama | berlibur
1212,1774798403683,KEEP,Aku sedang menunggu teman di Bahrain sekarang,aku | bahrain | di | menunggu | sedang | sekarang | teman,bahrain
1213,1774798415860,KEEP,Apakah kamu sudah mengirim paket ke Bangladesh?,apakah | bangladesh | kamu | ke | mengirim | paket | sudah,bangladesh
1214,1774798429530,KEEP,Kami akan mengunjungi Barbados bulan depan,akan | barbados | bulan | depan | kami | mengunjungi,barbados
1215,1774798450890,KEEP,Dia belum pernah tinggal di Belarusia,belarusia | belum | di | dia | pernah | tinggal,belarusia
1216,1774798462965,KEEP,Apakah kamu sudah pernah ke Belgia sebelumnya?,apakah | belgia | kamu | ke | pernah | sebelumnya | sudah,belgia
1217,1774798480537,KEEP,Aku akan mengunjungi Belize saat liburan nanti,akan | aku | belize | liburan | mengunjungi | nanti | saat,belize
1218,1774798495486,KEEP,Mereka sedang bekerja di Benin sekarang,bekerja | benin | di | mereka | sedang | sekarang,benin
1219,1774798509285,KEEP,Apakah kamu pernah mendaki di Bhutan?,apakah | bhutan | di | kamu | mendaki | pernah,bhutan
1220,1774798522282,KEEP,Aku belum pernah mengunjungi Bolivia sebelumnya,aku | belum | bolivia | mengunjungi | pernah | sebelumnya,bolivia
1221,1774798537826,KEEP,Mereka akan melakukan safari di Botswana tahun ini,akan | botswana | di | ini | melakukan | mereka | safari | tahun,botswana | melakukan | safari
1222,1774798554060,KEEP,Aku sedang belajar bahasa Portugis untuk pergi ke Brasil,aku | bahasa | belajar | brasil | ke | pergi | portugis | sedang | untuk,brasil | portugis
1223,1774798567839,KEEP,Apakah dia sudah tinggal di Brunei sebelumnya?,apakah | brunei | di | dia | sebelumnya | sudah | tinggal,brunei
1224,1774798580866,KEEP,Aku akan menghadiri konferensi di Bulgaria minggu depan,akan | aku | bulgaria | depan | di | konferensi | menghadiri | minggu,bulgaria
1225,1774798594067,KEEP,Mereka belum pernah mengunjungi Burundi sebelumnya,belum | burundi | mengunjungi | mereka | pernah | sebelumnya,burundi
1226,1774798604740,KEEP,Aku sedang merencanakan perjalanan ke Kamboja bulan depan,aku | bulan | depan | kamboja | ke | merencanakan | perjalanan | sedang,kamboja
1227,1774798621552,KEEP,Apakah kamu akan tinggal di Kamerun tahun ini?,akan | apakah | di | ini | kamerun | kamu | tahun | tinggal,kamerun
1228,1774798643533,KEEP,Aku sudah bekerja di Kanada selama tiga tahun,aku | bekerja | di | kanada | selama | sudah | tahun | tiga,kanada
1229,1774798674645,KEEP,Mereka sedang membangun proyek baru di Chad,baru | chad | di | membangun | mereka | proyek | sedang,chad
1230,1774798688779,KEEP,Aku akan berlibur di Chili musim panas ini,akan | aku | berlibur | chili | di | ini | musim | panas,chili
1231,1774798729529,KEEP,Dia belum pernah belajar bahasa Mandarin di Cina,bahasa | belajar | belum | cina | di | dia | mandarin | pernah,cina | mandarin
1232,1774798741051,KEEP,Apakah kamu akan mengunjungi Kolombia bulan depan?,akan | apakah | bulan | depan | kamu | kolombia | mengunjungi,kolombia
1233,1774798750615,KEEP,Mereka sedang melakukan penelitian di Komoro sekarang,di | komoro | melakukan | mereka | penelitian | sedang | sekarang,komoro | penelitian
1234,1774798763627,KEEP,Aku akan berlayar di Kroasia musim panas nanti,akan | aku | berlayar | di | kroasia | musim | nanti | panas,berlayar | kroasia
1235,1774798785163,KEEP,Apakah mereka sudah pernah tinggal di Kuba?,apakah | di | kuba | mereka | pernah | sudah | tinggal,kuba
1236,1774798796488,KEEP,Aku sedang merencanakan perjalanan ke Siprus bulan depan,aku | bulan | depan | ke | merencanakan | perjalanan | sedang | siprus,siprus
1237,1774798809331,KEEP,Apakah kamu akan belajar di Ceko tahun ini?,akan | apakah | belajar | ceko | di | ini | kamu | tahun,ceko
1238,1774798820239,KEEP,Aku belum pernah mengunjungi Denmark sebelumnya,aku | belum | denmark | mengunjungi | pernah | sebelumnya,denmark
1239,1774798836179,KEEP,Mereka akan melakukan ekspedisi ilmiah di Djibouti,akan | di | djibouti | ekspedisi | ilmiah | melakukan | mereka,djibouti | ekspedisi
1240,1774798850430,KEEP,Aku akan berlibur di Dominika bulan depan,akan | aku | berlibur | bulan | depan | di | dominika,dominika
1241,1774798868178,KEEP,Apakah dia sudah pernah tinggal di Ekuador?,apakah | di | dia | ekuador | pernah | sudah | tinggal,ekuador
1242,1774798908595,KEEP,Mereka belum pernah mengunjungi Eritrea sebelumnya,belum | eritrea | mengunjungi | mereka | pernah | sebelumnya,eritrea
1243,1774798917947,KEEP,Aku akan menghadiri konferensi di Estonia minggu depan,akan | aku | depan | di | estonia | konferensi | menghadiri | minggu,estonia
1244,1774798931531,KEEP,Apakah mereka akan tinggal di Eswatini tahun ini?,akan | apakah | di | eswatini | ini | mereka | tahun | tinggal,eswatini
1245,1774798943041,KEEP,Aku sedang merencanakan perjalanan ke Ethiopia bulan depan,aku | bulan | depan | ethiopia | ke | merencanakan | perjalanan | sedang,ethiopia
1246,1774798960268,KEEP,Mereka akan berlibur di Fiji musim panas ini,akan | berlibur | di | fiji | ini | mereka | musim | panas,fiji
1247,1774798972892,KEEP,Aku belum pernah belajar di Finlandia sebelumnya,aku | belajar | belum | di | finlandia | pernah | sebelumnya,finlandia
1248,1774798984753,KEEP,Apakah kamu akan tinggal di Prancis tahun depan?,akan | apakah | depan | di | kamu | prancis | tahun | tinggal,prancis
1249,1774798997736,KEEP,Mereka sedang melakukan penelitian di Gabon sekarang,di | gabon | melakukan | mereka | penelitian | sedang | sekarang,gabon
