order,note_id,status,front_text,tokens,new_tokens
873,1774526134801,KEEP,Atap rumah itu ditopang oleh balok kayu,atap | balok | ditopang | itu | kayu | oleh | rumah,ditopang
874,1774526201502,KEEP,Aku menancapkan paku di dinding untuk foto,aku | di | dinding | foto | menancapkan | paku | untuk,menancapkan | paku
875,1774526235590,KEEP,Aku akan ambil buku itu dari rak,akan | aku | ambil | buku | dari | itu | rak,rak
876,1774526250799,KEEP,Aku meletakkan kepala di bantal empuk,aku | bantal | di | empuk | kepala | meletakkan,bantal | empuk | meletakkan
877,1774526257790,KEEP,Pakaian itu disimpan rapi di lemari,di | disimpan | itu | lemari | pakaian | rapi,disimpan | lemari
878,1774526275874,KEEP,Aku memanjat tangga untuk ambil buku,aku | ambil | buku | memanjat | tangga | untuk,memanjat
879,1774526286390,KEEP,Aku akan mendaki gunung akhir pekan ini,akan | akhir | aku | gunung | ini | mendaki | pekan,pekan
880,1774526295052,KEEP,Aku sibuk bekerja sepanjang pekan ini,aku | bekerja | ini | pekan | sepanjang | sibuk,sibuk
881,1774530033290,KEEP,Hidungku gatal karena alergi debu,alergi | debu | gatal | hidungku | karena,alergi | debu | gatal | hidungku
882,1774530077623,KEEP,Telingaku sakit setelah berenang kemarin,berenang | kemarin | sakit | setelah | telingaku,telingaku
883,1774530199016,KEEP,Aku membaca seluruh buku itu semalam,aku | buku | itu | membaca | seluruh | semalam,seluruh
884,1774530219353,KEEP,Kami menghabiskan keseluruhan hari di pantai,di | hari | kami | keseluruhan | menghabiskan | pantai,keseluruhan | menghabiskan
885,1774530310018,KEEP,Restoran itu terkenal dengan masakan pedasnya,dengan | itu | masakan | pedasnya | restoran | terkenal,masakan | pedasnya
886,1774534037503,KEEP,Aku sudah memakai anting itu sejak pagi,aku | anting | itu | memakai | pagi | sejak | sudah,anting
887,1774534042183,KEEP,Aku akan pergi ke bandara besok pagi,akan | aku | bandara | besok | ke | pagi | pergi,bandara
888,1774534056855,KEEP,Aku sedang membersihkan rumah sebelum tamu datang,aku | datang | membersihkan | rumah | sebelum | sedang | tamu,tamu
889,1774534066960,KEEP,Perabot di rumah baru kami sangat modern,baru | di | kami | modern | perabot | rumah | sangat,perabot
890,1774534075399,KEEP,Aku selalu menyikat gigi dengan sikat baru setiap minggu,aku | baru | dengan | gigi | menyikat | minggu | selalu | setiap | sikat,sikat
891,1774534101054,KEEP,Aku menerima paket dari toko online kemarin sore,aku | dari | kemarin | menerima | online | paket | sore | toko,online
892,1774534114067,KEEP,Aku akan mengintegrasikan sistem baru ke dalam aplikasi,akan | aku | aplikasi | baru | dalam | ke | mengintegrasikan | sistem,mengintegrasikan
893,1774534123019,KEEP,Integrasi data antara dua sistem selesai minggu lalu,antara | data | dua | integrasi | lalu | minggu | selesai | sistem,integrasi
894,1774534136825,KEEP,Aku duduk di kursi antara dua temanku,aku | antara | di | dua | duduk | kursi | temanku,kursi
895,1774534164827,KEEP,Pengiriman barang dari toko itu biasanya cepat,barang | biasanya | cepat | dari | itu | pengiriman | toko,pengiriman
896,1774534179789,KEEP,Aku baru saja membeli sepeda motor baru kemarin,aku | baru | kemarin | membeli | motor | saja | sepeda,motor
897,1774534206353,KEEP,Cukup duduk di sini aja jangan bergerak,aja | bergerak | cukup | di | duduk | jangan | sini,aja
898,1774534215088,KEEP,Jangan gerak dulu sampai aku bilang siap,aku | bilang | dulu | gerak | jangan | sampai | siap,gerak
899,1774534238194,KEEP,Dia bernyanyi seperti penyanyi profesional di konser,bernyanyi | di | dia | konser | penyanyi | profesional | seperti,bernyanyi | penyanyi
900,1774534258730,KEEP,Kami sering pergi ke bioskop setiap akhir pekan,akhir | bioskop | kami | ke | pekan | pergi | sering | setiap,bioskop
901,1774534268495,KEEP,Aku sedang mengobrol dengan teman lama lewat pesan,aku | dengan | lama | lewat | mengobrol | pesan | sedang | teman,mengobrol
902,1774534296991,KEEP,Aku sering bermain permainan video sebelum tidur,aku | bermain | permainan | sebelum | sering | tidur | video,permainan
903,1774534321562,KEEP,Pengujian sistem baru akan dilakukan minggu depan,akan | baru | depan | dilakukan | minggu | pengujian | sistem,dilakukan | pengujian
904,1774534338107,KEEP,Aku bertemu dengan insinyur itu untuk membahas proyek,aku | bertemu | dengan | insinyur | itu | membahas | proyek | untuk,insinyur | membahas
905,1774534344534,KEEP,Tolong lakukan tugas ini sebelum jam lima sore,ini | jam | lakukan | lima | sebelum | sore | tolong | tugas,lakukan
906,1774534363112,KEEP,Aku mengecek data terbaru di dasbor setiap pagi,aku | dasbor | data | di | mengecek | pagi | setiap | terbaru,dasbor | mengecek | terbaru
907,1774534372595,KEEP,Elemen penting dari desain ini harus diperhatikan,dari | desain | diperhatikan | elemen | harus | ini | penting,desain | diperhatikan | elemen
908,1774534386612,KEEP,Aku merasa sedih di dalam hati saat mendengar berita itu,aku | berita | dalam | di | hati | itu | mendengar | merasa | saat | sedih,hati | sedih
909,1774534425992,KEEP,Dokter memeriksa jantungku karena detak yang tidak normal,detak | dokter | jantungku | karena | memeriksa | normal | tidak | yang,detak | jantungku | normal
910,1774534443651,KEEP,Aku jg akan ikut ke pesta nanti malam,akan | aku | ikut | jg | ke | malam | nanti | pesta,jg
911,1774534453453,KEEP,Aku terlambat karna hujan deras tadi pagi,aku | deras | hujan | karna | pagi | tadi | terlambat,karna
912,1774534462607,KEEP,Aku harus ulang pelajaran itu supaya lebih paham,aku | harus | itu | lebih | paham | pelajaran | supaya | ulang,supaya
913,1774534472995,KEEP,Tolong ulangi pertanyaan itu supaya aku jelas mendengar,aku | itu | jelas | mendengar | pertanyaan | supaya | tolong | ulangi,ulangi
914,1774534482925,KEEP,Aku memesan sup ayam hangat untuk makan siang,aku | ayam | hangat | makan | memesan | siang | sup | untuk,ayam | memesan
915,1774534497164,KEEP,Babi itu sedang tidur di halaman belakang,babi | belakang | di | halaman | itu | sedang | tidur,babi | belakang
916,1774534522391,KEEP,Aku melihat anak kecil menangis di taman tadi,aku | anak | di | kecil | melihat | menangis | tadi | taman,menangis
917,1774534545070,KEEP,Kita harus menjaga lingkungan agar tetap bersih dan sehat,agar | bersih | dan | harus | kita | lingkungan | menjaga | sehat | tetap,lingkungan
918,1774534599056,KEEP,Aku merasa aman saat berada di rumah bersama keluargaku,aku | aman | berada | bersama | di | keluargaku | merasa | rumah | saat,aman
919,1774534608459,KEEP,Keselamatan pekerja selalu menjadi prioritas utama perusahaan,keselamatan | menjadi | pekerja | perusahaan | prioritas | selalu | utama,keselamatan | pekerja | prioritas
920,1774534633333,KEEP,Aku berdoa kepada Tuhan setiap pagi sebelum bekerja,aku | bekerja | berdoa | kepada | pagi | sebelum | setiap | tuhan,berdoa | kepada | tuhan
921,1774534677160,KEEP,Dokumen penting disimpan aman di dalam brankas,aman | brankas | dalam | di | disimpan | dokumen | penting,brankas
922,1774534702981,KEEP,Tolong simpan barang itu di lemari setelah dipakai,barang | di | dipakai | itu | lemari | setelah | simpan | tolong,simpan
923,1774534712878,KEEP,Aku minta maaf karena terlambat datang ke pertemuan,aku | datang | karena | ke | maaf | minta | pertemuan | terlambat,maaf
924,1774534743666,KEEP,Aku selalu membawa ransel saat pergi ke sekolah,aku | ke | membawa | pergi | ransel | saat | sekolah | selalu,ransel
925,1774534753928,KEEP,Aku menulis catatan penting dengan pensil baru hari ini,aku | baru | catatan | dengan | hari | ini | menulis | pensil | penting,pensil
926,1774534809720,KEEP,Aku membeli sebotol anggur merah untuk pesta malam ini,aku | anggur | ini | malam | membeli | merah | pesta | sebotol | untuk,anggur | sebotol
927,1774534819255,KEEP,Aku mengisi botol dengan air mineral sebelum pergi,air | aku | botol | dengan | mengisi | mineral | pergi | sebelum,mineral
928,1774534837310,KEEP,Aku akan isi formulir pendaftaran sebelum jam lima,akan | aku | formulir | isi | jam | lima | pendaftaran | sebelum,formulir | isi
929,1774534849604,KEEP,Aku mencukur bulu tubuh sebelum pergi ke pantai,aku | bulu | ke | mencukur | pantai | pergi | sebelum | tubuh,bulu | mencukur | tubuh
930,1774534859948,KEEP,Aku harus cukur jenggot sebelum rapat penting besok,aku | besok | cukur | harus | jenggot | penting | rapat | sebelum,cukur | jenggot
931,1774534871567,KEEP,Kucing itu memiliki bulu yang lembut dan halus,bulu | dan | halus | itu | kucing | lembut | memiliki | yang,halus | lembut
932,1774534900490,KEEP,Aku akan beli baju baru di toko besok,akan | aku | baju | baru | beli | besok | di | toko,baju
933,1774534912904,KEEP,Aku harus tulis laporan sebelum jam pulang kantor,aku | harus | jam | kantor | laporan | pulang | sebelum | tulis,tulis
934,1774534918320,KEEP,Aku mencuci pakaian kotor setiap malam sebelum tidur,aku | kotor | malam | mencuci | pakaian | sebelum | setiap | tidur,kotor
935,1774534944561,KEEP,Aku merasa gemuk setelah makan banyak kue tadi,aku | banyak | gemuk | kue | makan | merasa | setelah | tadi,gemuk
936,1774534954514,KEEP,Dia terlihat kurus karena jarang makan malam,dia | jarang | karena | kurus | makan | malam | terlihat,kurus
937,1774535484086,KEEP,Aku tidak suka orang yang berbohong tentang masalah serius,aku | berbohong | masalah | orang | serius | suka | tentang | tidak | yang,berbohong
938,1774535504054,KEEP,Aku belajar sejarah Indonesia di sekolah setiap minggu,aku | belajar | di | indonesia | minggu | sejarah | sekolah | setiap,sejarah
939,1774535526669,KEEP,Aku ingin selajah kota tua saat liburan nanti,aku | ingin | kota | liburan | nanti | saat | selajah | tua,selajah
940,1774535543129,KEEP,Aku menulis namur temanku di daftar hadir hari ini,aku | daftar | di | hadir | hari | ini | menulis | namur | temanku,namur
941,1774535573441,KEEP,Pemerintah sedang memperbaiki infrastruktur jalan di kota ini,di | infrastruktur | ini | jalan | kota | memperbaiki | pemerintah | sedang,infrastruktur | pemerintah
942,1774535590488,KEEP,Pekerja mencampur semen untuk membangun dinding baru,baru | dinding | membangun | mencampur | pekerja | semen | untuk,mencampur
943,1774535662750,KEEP,Aku akan campur tepung dan gula untuk kue,akan | aku | campur | dan | gula | kue | tepung | untuk,campur
944,1774535734618,KEEP,Aku sudah membereskan semuanya sebelum tamu datang,aku | datang | membereskan | sebelum | semuanya | sudah | tamu,membereskan | semuanya
945,1774535742829,KEEP,Aku harus beres pekerjaan ini sebelum jam lima,aku | beres | harus | ini | jam | lima | pekerjaan | sebelum,beres
946,1774535916934,KEEP,Peradaban kuno Mesir terkenal dengan piramida megahnya,dengan | kuno | megahnya | mesir | peradaban | piramida | terkenal,kuno | megahnya | mesir | peradaban | piramida
947,1774535948257,KEEP,Turis itu mengagumi piramida di Mesir dengan kagum,dengan | di | itu | kagum | mengagumi | mesir | piramida | turis,kagum | mengagumi | turis
948,1774535985713,KEEP,Aku merasa agum melihat lukisan indah di museum,agum | aku | di | indah | lukisan | melihat | merasa | museum,agum | museum
949,1774535999952,KEEP,Anak itu senang belajar tentang dinosaurus di sekolah,anak | belajar | di | dinosaurus | itu | sekolah | senang | tentang,dinosaurus | senang
950,1774536053586,KEEP,Aku merasakan kehangatan matahari di pagi hari,aku | di | hari | kehangatan | matahari | merasakan | pagi,kehangatan
951,1774536095250,KEEP,Aku menulis catatan penting di selembar kertas,aku | catatan | di | kertas | menulis | penting | selembar,selembar
952,1774540328237,KEEP,Aku belum melihat nyamuk di kamar,aku | belum | di | kamar | melihat | nyamuk,nyamuk
953,1774540336953,KEEP,Aku pernah melihat komodo di pulau itu,aku | di | itu | komodo | melihat | pernah | pulau,komodo | pulau
954,1774540345608,KEEP,Apakah naga itu benar-benar ada?,ada | apakah | benar-benar | itu | naga,naga
955,1774540357034,KEEP,Ular itu sedang bergerak di pasir,bergerak | di | itu | pasir | sedang | ular,ular
956,1774540382864,KEEP,Kami akan melewati rawa besok pagi,akan | besok | kami | melewati | pagi | rawa,melewati | rawa
957,1774540398279,KEEP,"Di balik gunung itu, ada desa kecil",ada | balik | desa | di | gunung | itu | kecil,balik
958,1774540403422,KEEP,Aku sedang melewati fase sulit dalam hidup,aku | dalam | fase | hidup | melewati | sedang | sulit,fase
959,1774540424908,KEEP,Aku tidak berani cium dia di depan,aku | berani | cium | depan | di | dia | tidak,cium
960,1774540444662,KEEP,Aroma bunga itu sangat kuat di taman,aroma | bunga | di | itu | kuat | sangat | taman,aroma
961,1774540465503,KEEP,Determinasi itu membantuku menyelesaikan tugas sulit,determinasi | itu | membantuku | menyelesaikan | sulit | tugas,determinasi | membantuku
962,1774540475897,KEEP,Kesedihan itu muncul setelah berita buruk tadi,berita | buruk | itu | kesedihan | muncul | setelah | tadi,kesedihan
963,1774540502553,KEEP,Peri itu muncul di taman saat senja,di | itu | muncul | peri | saat | senja | taman,peri | senja
964,1774540514935,KEEP,Cincin itu dihiasi zamrud hijau indah,cincin | dihiasi | hijau | indah | itu | zamrud,dihiasi | zamrud
965,1774540530025,KEEP,Bunga-bunga itu menghiasi meja makan malam ini,bunga-bunga | ini | itu | makan | malam | meja | menghiasi,bunga-bunga | menghiasi
966,1774540544975,KEEP,Kain ini terasa lembut saat disentuh,disentuh | ini | kain | lembut | saat | terasa,disentuh | kain
967,1774540669957,KEEP,Perusahaan itu akan mengimpor barang dari Jepang,akan | barang | dari | itu | jepang | mengimpor | perusahaan,mengimpor
968,1774540711479,KEEP,Dia akan menjadi kaya jika terus bekerja keras,akan | bekerja | dia | jika | kaya | keras | menjadi | terus,kaya | terus
969,1774540722299,KEEP,Banyak keluarga miskin tinggal di desa itu,banyak | desa | di | itu | keluarga | miskin | tinggal,miskin
970,1774540735680,KEEP,Kemiskinan membuat anak-anak sulit pergi sekolah,anak-anak | kemiskinan | membuat | pergi | sekolah | sulit,kemiskinan
971,1774540774438,KEEP,Aku akan mengikuti jejak kakakku besok,akan | aku | besok | jejak | kakakku | mengikuti,jejak | kakakku
972,1774540787794,KEEP,Kakak selalu membantuku saat kesulitan,kakak | kesulitan | membantuku | saat | selalu,kakak | kesulitan
973,1774540822378,KEEP,Asap dari dapur membuat mata aku perih,aku | asap | dapur | dari | mata | membuat | perih,perih
974,1774540832710,KEEP,Mataku terasa perih setelah terkena debu,debu | mataku | perih | setelah | terasa | terkena,mataku
975,1774540979178,KEEP,Lebah itu menyengat tanganku kemarin sore,itu | kemarin | lebah | menyengat | sore | tanganku,lebah | menyengat
976,1774541095216,KEEP,Aku minum bir bersama teman tadi malam,aku | bersama | bir | malam | minum | tadi | teman,bir
977,1774541129813,KEEP,Baju itu sudah kering setelah dijemur,baju | dijemur | itu | kering | setelah | sudah,dijemur
978,1774541144235,KEEP,Aku menjemur pakaian di balkon pagi ini,aku | balkon | di | ini | menjemur | pagi | pakaian,balkon | menjemur
979,1774541155447,KEEP,Kami duduk santai di balkon sambil minum teh,balkon | di | duduk | kami | minum | sambil | santai | teh,santai
980,1774541185074,KEEP,Aku mengikat barang itu dengan tali kuat,aku | barang | dengan | itu | kuat | mengikat | tali,mengikat | tali
981,1774541197271,KEEP,Aku selalu mengingat nasihat guru kemarin,aku | guru | kemarin | mengingat | nasihat | selalu,mengingat
982,1774541221737,KEEP,Aku teringat wajahnya saat hujan turun,aku | hujan | saat | teringat | turun | wajahnya,teringat
983,1774541235051,KEEP,Pesanmu akan selalu diingat oleh aku,akan | aku | diingat | oleh | pesanmu | selalu,diingat
984,1774541257548,KEEP,Aku menyalin dokumen itu ke komputer,aku | dokumen | itu | ke | komputer | menyalin,komputer | menyalin
985,1774541273732,KEEP,Aku membuat salin dokumen penting itu,aku | dokumen | itu | membuat | penting | salin,salin
986,1774541405061,KEEP,Aku hanya akan inap satu malam di sini,akan | aku | di | hanya | inap | malam | satu | sini,inap
987,1774541457227,KEEP,Laba-laba itu merayap di dinding kamar,di | dinding | itu | kamar | laba-laba | merayap,laba-laba | merayap
988,1774541580778,KEEP,Burung itu terbang tinggi dengan sayap lebar,burung | dengan | itu | lebar | sayap | terbang | tinggi,lebar | sayap
989,1774541593339,KEEP,"Bang, tolong ambilkan aku air minum",air | aku | ambilkan | bang | minum | tolong,ambilkan | bang
990,1774541619223,KEEP,Kucing itu mengibaskan ekornya dengan cepat,cepat | dengan | ekornya | itu | kucing | mengibaskan,ekornya | mengibaskan
991,1774541641446,KEEP,Aku memotong kuku tangan sebelum tidur,aku | kuku | memotong | sebelum | tangan | tidur,kuku
992,1774541738615,KEEP,File itu sudah diduplikasi beberapa kali kemarin,beberapa | diduplikasi | file | itu | kali | kemarin | sudah,diduplikasi
993,1774541748304,KEEP,Aku akan menduplikasi dokumen ini besok,akan | aku | besok | dokumen | ini | menduplikasi,menduplikasi
994,1774541780120,KEEP,Dia percaya orang jahat akan pergi ke neraka,akan | dia | jahat | ke | neraka | orang | percaya | pergi,jahat | neraka
995,1774541812883,KEEP,Malaikat itu digambarkan terbang di langit,di | digambarkan | itu | langit | malaikat | terbang,digambarkan | malaikat
996,1774541825629,KEEP,Aku sedang menggambar pemandangan di buku,aku | buku | di | menggambar | pemandangan | sedang,menggambar
997,1774541831019,KEEP,Tolong gambarkan ide itu dengan jelas,dengan | gambarkan | ide | itu | jelas | tolong,gambarkan
998,1774541844936,KEEP,Pohon itu digambar di papan tulis kemarin,di | digambar | itu | kemarin | papan | pohon | tulis,digambar | papan
999,1774541881950,KEEP,Aku membuka situs itu di peramban baru,aku | baru | di | itu | membuka | peramban | situs,peramban | situs
1000,1774541909206,KEEP,Kota itu terletak di selatan pulau Jawa,di | itu | jawa | kota | pulau | selatan | terletak,jawa
1001,1774543521933,KEEP,Hotel itu sudah terkenal karena restorannya berbintang,berbintang | hotel | itu | karena | restorannya | sudah | terkenal,berbintang | restorannya
1002,1774543538197,KEEP,Apakah kamu sudah membagikan tautan artikel itu?,apakah | artikel | itu | kamu | membagikan | sudah | tautan,artikel | membagikan | tautan
1003,1774543547976,KEEP,Aku selalu ingin bagi ilmu dengan teman-teman,aku | bagi | dengan | ilmu | ingin | selalu | teman-teman,ilmu | teman-teman
1004,1774543560418,KEEP,Aku belum selesai menulis dok itu untuk rapat,aku | belum | dok | itu | menulis | rapat | selesai | untuk,dok
1005,1774543567434,KEEP,Aku akan tambah teman baru di grup ini,akan | aku | baru | di | grup | ini | tambah | teman,tambah
1006,1774543622073,KEEP,Aku belum mendapatkan info terbaru tentang acara itu,acara | aku | belum | info | itu | mendapatkan | tentang | terbaru,info | mendapatkan
1007,1774602848610,KEEP,Aku akan mencari solusi lain besok,akan | aku | besok | lain | mencari | solusi,solusi
1008,1774602956689,KEEP,Rasa ini bukan gabungan yang biasa,biasa | bukan | gabungan | ini | rasa | yang,gabungan
1009,1774602982375,KEEP,Aku belum pernah melihat lautan seluas ini,aku | belum | ini | lautan | melihat | pernah | seluas,lautan | seluas
1010,1774602994002,KEEP,Apakah sungai itu masih mengalir deras?,apakah | deras | itu | masih | mengalir | sungai,mengalir
1011,1774603010861,KEEP,Aku harusnya sudah berangkat lebih awal,aku | awal | berangkat | harusnya | lebih | sudah,harusnya
1012,1774603045861,KEEP,Koneksi internetku belum stabil sejak tadi,belum | internetku | koneksi | sejak | stabil | tadi,internetku | koneksi
1013,1774603058780,KEEP,Apakah Anda sudah menerima pesannya?,anda | apakah | menerima | pesannya | sudah,pesannya
1014,1774603077178,KEEP,Tolong sambungkan kabel itu ke komputer,itu | kabel | ke | komputer | sambungkan | tolong,kabel | sambungkan
1015,1774603090088,KEEP,Aku selalu membuka beranda setiap pagi,aku | beranda | membuka | pagi | selalu | setiap,beranda
1016,1774603145841,KEEP,Buku ini memiliki glosarium di akhir,akhir | buku | di | glosarium | ini | memiliki,glosarium
1017,1774603151590,KEEP,Kebencian itu hanya akan menyakiti diri sendiri,akan | diri | hanya | itu | kebencian | menyakiti | sendiri,kebencian | menyakiti
1018,1774603185102,KEEP,Aku benar-benar benci hujan deras hari ini,aku | benar-benar | benci | deras | hari | hujan | ini,benci
1019,1774603241777,KEEP,"Brengsek, aku lupa mengerjakan tugas itu",aku | brengsek | itu | lupa | mengerjakan | tugas,brengsek | mengerjakan
1020,1774603263189,KEEP,Anak itu hampir tenggelam di kolam renang,anak | di | hampir | itu | kolam | renang | tenggelam,renang
1021,1774603349389,KEEP,Instruksi ini sangat langsung dan mudah diikuti,dan | diikuti | ini | instruksi | langsung | mudah | sangat,instruksi
1022,1774603363802,KEEP,Kita harus maju meski jalannya sulit,harus | jalannya | kita | maju | meski | sulit,jalannya | maju
1023,1774603369255,KEEP,Aku memilih desain rumah yang sederhana,aku | desain | memilih | rumah | sederhana | yang,sederhana
1024,1774603497842,KEEP,Kucing itu tidur di lantai telanjang,di | itu | kucing | lantai | telanjang | tidur,telanjang
1025,1774603504866,KEEP,Mobil itu bergerak mundur pelan-pelan,bergerak | itu | mobil | mundur | pelan-pelan,pelan-pelan
1026,1774603606967,KEEP,Mereka terdampar di gurun panas sepanjang hari,di | gurun | hari | mereka | panas | sepanjang | terdampar,gurun | terdampar
1027,1774603639177,KEEP,Perahu itu terdampar di tepi pantai semalam,di | itu | pantai | perahu | semalam | tepi | terdampar,tepi
1028,1774603645879,KEEP,Aku menaruh penutup pada buku yang terbuka,aku | buku | menaruh | pada | penutup | terbuka | yang,penutup
1029,1774603685376,KEEP,Dia mencoba aruh pendapatnya pada teman,aruh | dia | mencoba | pada | pendapatnya | teman,aruh | pendapatnya
1030,1774603688604,KEEP,Berita itu bisa mempengaruhi keputusan banyak orang,banyak | berita | bisa | itu | keputusan | mempengaruhi | orang,mempengaruhi
1031,1774603702510,KEEP,Aku ingin tinggal di pedesaan yang tenang,aku | di | ingin | pedesaan | tenang | tinggal | yang,pedesaan
1032,1774603710472,KEEP,Kesehatan di daerah pedesaan sering kurang terjangkau,daerah | di | kesehatan | kurang | pedesaan | sering | terjangkau,kurang | terjangkau
1033,1774603724378,KEEP,Harga itu tidak mudah jangkau oleh anak muda,anak | harga | itu | jangkau | muda | mudah | oleh | tidak,jangkau
1034,1774603792836,KEEP,Aku pergi ke penjahit untuk menjahit jas baru,aku | baru | jas | ke | menjahit | penjahit | pergi | untuk,jas | menjahit | penjahit
1035,1774603810944,KEEP,Aku belajar jahit baju sendiri di rumah,aku | baju | belajar | di | jahit | rumah | sendiri,jahit
1036,1774603840916,KEEP,Es krim ini memiliki rasa cokelat yang unik,cokelat | es | ini | krim | memiliki | rasa | unik | yang,unik
1037,1774603870776,KEEP,Aku mengunduh aplikasi baru di ponsel,aku | aplikasi | baru | di | mengunduh | ponsel,mengunduh
1038,1774603894772,KEEP,Ayahku bekerja di pertanian setiap pagi,ayahku | bekerja | di | pagi | pertanian | setiap,pertanian
1039,1774603911187,KEEP,Perawat itu mengambil darah untuk tes laboratorium,darah | itu | laboratorium | mengambil | perawat | tes | untuk,darah | perawat
1040,1774603918359,KEEP,Aku mulai mengeluarkan darah setelah terluka,aku | darah | mengeluarkan | mulai | setelah | terluka,mengeluarkan | terluka
1041,1774708222016,KEEP,Apakah aku pernah melihat raksasa itu?,aku | apakah | itu | melihat | pernah | raksasa,raksasa
1042,1774708373020,KEEP,Aku sudah mengubah kebiasaan burukku,aku | burukku | kebiasaan | mengubah | sudah,burukku
1043,1774708548999,KEEP,Kucing itu sedang tidur di bawah meja,bawah | di | itu | kucing | meja | sedang | tidur,bawah
1044,1774708665301,KEEP,Seseorang sedang menungguku di luar,di | luar | menungguku | sedang | seseorang,menungguku
1045,1774708682087,KEEP,Aku sedang mengetik pesan untukmu,aku | mengetik | pesan | sedang | untukmu,mengetik
1046,1774708707375,KEEP,Aku ingin menempel stiker itu di laptop,aku | di | ingin | itu | laptop | menempel | stiker,laptop | menempel | stiker
1047,1774708734277,KEEP,Aku akan menempel poster di dinding,akan | aku | di | dinding | menempel | poster,poster
1048,1774708790456,KEEP,Aku membeli stroberi segar di pasar,aku | di | membeli | pasar | segar | stroberi,stroberi
1049,1774708917301,KEEP,Aku sedang membersihkan cermin kamar mandi,aku | cermin | kamar | mandi | membersihkan | sedang,cermin
1050,1774708947420,KEEP,Aku ingin tambah gula dalam kopiku,aku | dalam | gula | ingin | kopiku | tambah,kopiku
1051,1774708976501,KEEP,Aku harus mengurangi pengeluaran bulan ini,aku | bulan | harus | ini | mengurangi | pengeluaran,mengurangi | pengeluaran
1052,1774708983557,KEEP,Aku akan menambah jumlah buku di rak,akan | aku | buku | di | jumlah | menambah | rak,jumlah | menambah
1053,1774709028214,KEEP,Aku menyentuh siku temanku secara tidak sengaja,aku | menyentuh | secara | sengaja | siku | temanku | tidak,menyentuh | sengaja | siku
1054,1774709045246,KEEP,Aku sengaja meninggalkan kunci di rumah,aku | di | kunci | meninggalkan | rumah | sengaja,meninggalkan
1055,1774709075003,KEEP,Burung itu bertengger di pohon tinggi,bertengger | burung | di | itu | pohon | tinggi,bertengger
1056,1774709103598,KEEP,Aku memotong kuku jariku tadi malam,aku | jariku | kuku | malam | memotong | tadi,jariku
1057,1774709115248,KEEP,Aku akan bepergian ke Eropa musim panas ini,akan | aku | bepergian | eropa | ini | ke | musim | panas,eropa
1058,1774709200777,KEEP,Aku merasakan sakit di lengan kiriku,aku | di | kiriku | lengan | merasakan | sakit,kiriku | lengan
1059,1774709219482,KEEP,Aku belum pernah mencukur jenggotku bulan ini,aku | belum | bulan | ini | jenggotku | mencukur | pernah,jenggotku
1060,1774709256439,KEEP,Aku merasakan dingin di leherku tadi malam,aku | di | dingin | leherku | malam | merasakan | tadi,leherku
1061,1774709434075,KEEP,Kami berjalan-jalan di kuburan tua malam ini,berjalan-jalan | di | ini | kami | kuburan | malam | tua,berjalan-jalan | kuburan
